{
  "artifact_type": "execution_receipt",
  "created_at": "2026-05-06T18:21:00+00:00",
  "evidence_refs": [
    {
      "kind": "evidence_bundle",
      "path": "evidence_contract.json"
    }
  ],
  "execution": {
    "ended_at": "2026-05-06T18:21:00+00:00",
    "executed_command_count": 0,
    "network_execution_performed": false,
    "planned_command_count": 1,
    "started_at": "2026-05-06T18:21:00+00:00"
  },
  "links": {
    "execution_contract": {
      "descriptor": {
        "algorithm": "sha256",
        "artifact_type": "execution_contract",
        "canonical_bytes": 1449,
        "canonicalization": "sclite-json-v0.1",
        "digest": "573ea42c15c4cc82e422f0aef66f5303ad68bc9b77ba11df7d8a53f3edf3d6ca",
        "schema_ref": "schemas/execution_contract.v0.2.schema.json",
        "schema_version": "v0.2"
      },
      "role": "execution_contract"
    },
    "execution_ticket": {
      "descriptor": {
        "algorithm": "sha256",
        "artifact_type": "execution_ticket",
        "canonical_bytes": 1917,
        "canonicalization": "sclite-json-v0.1",
        "digest": "f003b4820d73ef4bc0c1ed5badef40f132e6b2d84ad10e07ef3f30da1802c063",
        "schema_ref": "schemas/execution_ticket.v0.2.schema.json",
        "schema_version": "v0.2"
      },
      "role": "execution_ticket"
    }
  },
  "non_claims": [
    "receipt_does_not_include_raw_logs",
    "receipt_does_not_claim_live_target_execution"
  ],
  "outcome": {
    "returncode": 0,
    "status": "dry_run",
    "stderr_present": false,
    "stdout_present": false,
    "summary": "Dry-run receipt for a public-safe lifecycle fixture."
  },
  "receipt_id": "receipt-demo-001",
  "runtime": {
    "mode": "dry_run",
    "name": "demo-runtime",
    "version": "fixture"
  },
  "schema_ref": "schemas/execution_receipt.v0.2.schema.json",
  "schema_version": "v0.2"
}
